{
  "$schema": "http://json-schema.org/draft-07/schema#",
  "title": "Tool Targets",
  "type": "object",
  "additionalProperties": false,
  "required": [
    "codex",
    "claude",
    "cursor",
    "copilot",
    "gemini"
  ],
  "properties": {
    "codex": {
      "type": "object",
      "additionalProperties": false,
      "required": [
        "skillsDir",
        "mcpConfig"
      ],
      "properties": {
        "skillsDir": {
          "type": "string",
          "minLength": 1
        },
        "mcpConfig": {
          "type": "string",
          "minLength": 1
        },
        "canOverride": {
          "type": "boolean"
        }
      }
    },
    "claude": {
      "type": "object",
      "additionalProperties": false,
      "required": [
        "skillsDir",
        "mcpConfig"
      ],
      "properties": {
        "skillsDir": {
          "type": "string",
          "minLength": 1
        },
        "mcpConfig": {
          "type": "string",
          "minLength": 1
        },
        "canOverride": {
          "type": "boolean"
        }
      }
    },
    "cursor": {
      "type": "object",
      "additionalProperties": false,
      "required": [
        "skillsDir",
        "mcpConfig"
      ],
      "properties": {
        "skillsDir": {
          "type": "string",
          "minLength": 1
        },
        "mcpConfig": {
          "type": "string",
          "minLength": 1
        },
        "canOverride": {
          "type": "boolean"
        }
      }
    },
    "copilot": {
      "type": "object",
      "additionalProperties": false,
      "required": [
        "skillsDir",
        "mcpConfig"
      ],
      "properties": {
        "skillsDir": {
          "type": "string",
          "minLength": 1
        },
        "mcpConfig": {
          "type": "string",
          "minLength": 1
        },
        "canOverride": {
          "type": "boolean"
        }
      }
    },
    "gemini": {
      "type": "object",
      "additionalProperties": false,
      "required": [
        "skillsDir",
        "mcpConfig"
      ],
      "properties": {
        "skillsDir": {
          "type": "string",
          "minLength": 1
        },
        "mcpConfig": {
          "type": "string",
          "minLength": 1
        },
        "canOverride": {
          "type": "boolean"
        }
      }
    }
  }
}
