{
  "codex": {
    "skillsDir": "%USERPROFILE%\\\\.codex\\\\skills\\\\vendor_imports",
    "mcpConfig": "%USERPROFILE%\\\\.codex\\\\config.toml",
    "canOverride": false
  },
  "claude": {
    "skillsDir": "%USERPROFILE%\\\\.claude\\\\skills",
    "mcpConfig": "%USERPROFILE%\\\\.claude\\\\mcp_servers.json",
    "canOverride": true
  },
  "cursor": {
    "skillsDir": "%USERPROFILE%\\\\.cursor\\\\skills",
    "mcpConfig": "%USERPROFILE%\\\\.cursor\\\\mcp.json",
    "canOverride": true
  },
  "copilot": {
    "skillsDir": "%USERPROFILE%\\\\.copilot\\\\skills",
    "mcpConfig": "%USERPROFILE%\\\\.copilot\\\\mcp-config.json",
    "canOverride": true
  },
  "gemini": {
    "skillsDir": "%USERPROFILE%\\\\.gemini\\\\skills",
    "mcpConfig": "%USERPROFILE%\\\\.gemini\\\\settings.json",
    "canOverride": false
  }
}
